{
  "page_id": "cover",
  "derived": {
    "prompt": "a silvered harbour under a cold sun, a single watchful figure",
    "avoid": "modern dress, machinery",
    "scene": "a silvered harbour under a cold sun, a single watchful figure"
  },
  "edited_prompt": null,
  "final_subject_prompt": "a silvered harbour under a cold sun, a single watchful figure",
  "wrapped_prompt": "19th-century steel engraving book illustration, fine crosshatching, monochrome ink, dramatic light, a silvered harbour under a cold sun, a single watchful figure, intricate linework, aged paper tone, high detail",
  "negative_prompt": "photo, color photograph, modern, text, watermark, signature, blurry, modern dress, machinery",
  "render": {
    "at": "2026-07-13T00:00:00Z",
    "params_echo": {
      "seed": 1234,
      "width": 832,
      "height": 1216,
      "steps": 30
    },
    "attempts": 1
  }
}
