{
  "page_id": "portrait-the-clockmaker",
  "derived": {
    "prompt": "bust portrait of a spare, white-haired artisan in a leather apron",
    "avoid": "modern dress, machinery",
    "scene": "bust portrait of a spare, white-haired artisan in a leather apron"
  },
  "edited_prompt": null,
  "final_subject_prompt": "bust portrait of a spare, white-haired artisan in a leather apron",
  "wrapped_prompt": "19th-century steel engraving book illustration, fine crosshatching, monochrome ink, dramatic light, bust portrait of a spare, white-haired artisan in a leather apron, intricate linework, aged paper tone, high detail",
  "negative_prompt": "photo, color photograph, modern, text, watermark, signature, blurry, modern dress, machinery",
  "render": {
    "at": "2026-07-13T00:00:00Z",
    "params_echo": {
      "seed": 1234,
      "width": 832,
      "height": 1216,
      "steps": 30
    },
    "attempts": 1
  }
}
