{
  "page_id": "0006",
  "derived": {
    "prompt": "a solitary hooded figure walking a cold stone harbour quay beneath a wide grey sky, shuttered stalls and coiled ropes along the wet stone",
    "depicted": [
      "the Wanderer"
    ],
    "shot": "wide",
    "avoid": [
      "color",
      "modern dress"
    ]
  },
  "edited_prompt": null,
  "final_subject_prompt": "a solitary hooded figure walking a cold stone harbour quay beneath a wide grey sky, shuttered stalls and coiled ropes along the wet stone",
  "wrapped_prompt": "19th-century steel engraving book illustration, fine crosshatching, monochrome ink, dramatic light, a solitary hooded figure walking a cold stone harbour quay beneath a wide grey sky, shuttered stalls and coiled ropes along the wet stone, intricate linework, aged paper tone, high detail",
  "negative_prompt": "photo, color photograph, modern, text, watermark, signature, blurry, color, modern dress",
  "render": {
    "at": "2026-07-13T00:00:00+00:00",
    "params_echo": {
      "seed": 3426432360,
      "width": 832,
      "height": 1216
    },
    "attempts": 1
  }
}
